url_slug	authors	title	Journal	Volume	Pages	Year	paper_url	excerpt
89	James F. Lutsko and Jean Pierre Boon	Microscopic theory of anomalous diffusion based on particle interactions	Phys. Rev. E	88	22108	2013	Lutsko_PRE_2013_1.pdf	We present a master equation formulation based on a Markovian random walk model that exhibits subdiffusion, classical diffusion, and superdiffusion as a function of a single parameter. The nonclassical diffusive behavior is generated by allowing for interactions between a population of walkers. At the macroscopic level, this gives rise to a nonlinear Fokker-Planck equation. The diffusive behavior is reflected not only in the mean squared displacement [〈r2(t)〉∼tγ with 0<γ≤1.5] but also in the existence of self-similar scaling solutions of the Fokker-Planck equation. We give a physical interpretation of sub- and superdiffusion in terms of the attractive and repulsive interactions between the diffusing particles and we discuss analytically the limiting values of the exponent γ. Simulations based on the master equation are shown to be in agreement with the analytical solutions of the nonlinear Fokker-Planck equation in all three diffusion regimes.
88	Jean Pierre Boon, James F. Lutsko, and Christopher Lutsko	Microscopic approach to nonlinear reaction-diffusion: The case of morphogen gradient formation	Phys. Rev. E	85	21126	2012	Boon_Lutsko__Lutsko_PRE_2012.pdf	We develop a microscopic theory for reaction-difusion (R-D) processes based on a generalization of Einstein's master equation with a reactive term and we show how the mean field formulation leads to a generalized R-D equation with non-classical solutions. For the n-th order annihilation reaction A+A+A+...+A->0, we obtain a nonlinear reaction-diffusion equation for which we discuss scaling and non-scaling formulations. We find steady states with either solutions exhibiting long range power law behavior (for n>α) showing the relative dominance of sub-diffusion over reaction effects in constrained systems, or conversely solutions (for n<α<n+1) with finite support of the concentration distribution describing situations where diffusion is slow and extinction is fast. Theoretical results are compared with experimental data for morphogen gradient formation.
87	James F. Lutsko	Nucleation of colloids and macromolecules: Does the nucleation pathway matter?	J. of Chemical Physics	136	134402	2012	Lutsko_JCP_2012_2.pdf	A recent description of diffusion-limited nucleation based on fluctuating hydrodynamics that extends classical nucleation theory predicts a very non-classical two-step scenario whereby nucleation is most likely to occur in spatially extended, low-amplitude density fluctuations. In this paper, it is shown how the formalism can be used to determine the maximum probability of observing any proposed nucleation pathway, thus allowing one to address the question as to their relative likelihood, including of the newly proposed pathway compared to classical scenarios. Calculations are presented for the nucleation of high-concentration droplets in a low-concentration solution of globular proteins and it is found that the relative probabilities (new theory compared to classical result) for reaching a critical nucleus containing Nc molecules scales as e−Nc/3 thus indicating that for all but the smallest nuclei, the classical scenario is extremely unlikely.
86	James F. Lutsko	Nucleation of colloids and macromolecules in a finite volume	J. of Chemical Physics	137	154903	2012	Lutsko_JCP_2012_3.pdf	A recently formulated description of homogeneous nucleation for Brownian particles in the over-damped limit based on fluctuating hydrodynamics is used to determine the nucleation pathway, characterized as the most likely path (MLP), for the nucleation of a dense-concentration droplet of globular protein from a dilute solution in a small, finite container. The calculations are performed by directly discretizing the equations for the MLP and it is found that they confirm previous results obtained for infinite systems: the process of homogeneous nucleation begins with a long-wavelength, spatially-extended concentration fluctuation that it condenses to form the pre-critical cluster. This is followed by a classical growth processes. The calculations show that the post-critical growth involves the formation of a depletion zone around the cluster whereas no such depletion is observed in the pre-critical cluster. The approach therefore captures dynamical effects not found in classical Density Functional Theory studies while consistently describing the formation of the pre-critical cluster.
85	James F. Lutsko	On the role of metastable intermediate states in the homogeneous nucleation of solids from solution	Adv. Chem. Phys.	151	137	2012	Lutsko_AdvChemPhys_2011.pdf	The role of metastable liquid phases in vapor-crystal nucleation is studied using Density Functional Theory(DFT). The model gives a semi-quantitatively accurate description of both the vapor-liquid-solid phase diagram for both simple fluids (Lennard-Jones interactions) and of the low-density/high-density/crystal phase diagram for model globular proteins (ten Wolde-Frenkel interaction). The density profile is characterized by two local order parameters, the average density and the crystallinity. The bulk free energy model is supplemented by squared-derivative terms in these order parameters to account for inhomogeneities thus producing a model similar in spirit to phase-field theory. It is shown that for both interaction models, the vapor-crystal part of the phase-diagram can be separated into regions for which metastable liquid phases are more or less stable than the vapor, but always less stable than the solid. The former case allows for the possibility of double nucleation whereby liquid droplets nucleate from the vapor followed by a separate nucleation of the solid phase within the liquid droplets. Whether or not this actually occurs depends on the relative free energy barriers for vapor-solid and vapor-liquid nucleation and it is shown that for simple fluids, double nucleation is indeed favored at sufficiently large supersaturation. Finally, by studying the minimum free energy path from the vapor to the solid, the separate possibility of transient nucleation.
84	James F. Lutsko	A dynamical theory of nucleation for colloids and macromolecules	J. of Chemical Physics	136	34509	2012	Lutsko_JCP_2012_1.pdf	A general theory of nucleation for colloids and macromolecules in solution is formulated within the context of fluctuating hydrodynamics. A formalism for the determination of nucleation pathways is developed and stochastic differential equations for the evolution of order parameters are given. The conditions under which the elements of Classical Nucleation Theory are recovered are determined. The theory provides a justification and extension of more heuristic equilibrium approaches based solely on the free energy. It is illustrated by application to the low-concentration/high-concentration transition in globular proteins where a novel two-step mechanism is identified where the first step involves the formation of long-wavelength density fluctuations and the second step is the actual nucleation event occuring within the fluctuation.
83	James F. Lutsko	A dynamical theory of homogeneous nucleation for colloids and macromolecules	J. of Chemical Physics	135	161101	2011	Lutsko_JCP_2011_2.pdf	Homogeneous nucleation is formulated within the context of fluctuating hydrodynamics. It is shown that for a colloidal or macromolecular system in the strong damping limit the most likely path for nucleation can be determined by gradient descent in density space governed by a nontrivial metric fixed by the dynamics. The theory provides a justification and extension of more heuristic equilibrium approaches based solely on the free energy. It is illustrated by application to liquid-vapor nucleation where it is shown that, in contrast to most free energy-based studies, the smallest clusters correspond to long wavelength, small amplitude perturbations.
82	James F. Lutsko	Density functional theory of inhomogeneous liquids. IV. Squared-gradient approximation and classical nucleation theory	J. of Chemical Physics	134	164501	2011	Lutsko_JCP_2011_1.pdf	The squared-gradient approximation to the modified-core Van der Waals density functional theory model is developed. A simple, explicit expression for the SGA coefficient involving only the bulk equation of state and the interaction potential is given. The model is solved for planar interfaces and spherical clusters and is shown to be quantitatively accurate in comparison to computer simulations. An approximate technique for solving the SGA based on piecewise-linear density profiles is introduced and is shown to give reasonable zeroth-order approximations to the numerical solution of the model. The piecewise-linear models of spherical clusters are shown to be a natural extension of classical nucleation theory and serve to clarify some of the nonclassical effects previously observed in liquid–vapor nucleation. Nucleation pathways are investigated using both constrained energy-minimization and steepest-descent techniques.
81	James F. Lutsko and Jean Pierre Boon	Questioning the validity of non-extensive thermodynamics for classical Hamiltonian systems.	EuroPhys. Lett.	95	20006	2011	Lutsko_2011_EPL_95_20006.pdf	We examine the non-extensive approach to the statistical mechanics of Hamiltonian systems with H = T +V, where T is the classical kinetic energy. Our analysis starts from the basics of the formalism by applying the standard variational method for maximizing the entropy subject to the average energy and normalization constraints. The analytical results show i) that the non-extensive thermodynamics formalism should be called into question to explain experimental results described by extended exponential distributions exhibiting long tails, i.e. q-exponentials with q >1, and ii) that in the thermodynamic limit the theory is only consistent in the range 0 q  1 where the distribution has finite support, thus implying that configurations with, e.g., energy above some limit have zero probability, which is at variance with the physics of systems in contact with a heat reservoir. We also discuss the (q-dependent) thermodynamic temperature and the generalized specific heat.
80	Jean Pierre Boon and James F. Lutsko	Nonextensive formalism and continuous Hamiltonian systems	Physics Letters A	375	329	2011	Lutsko_Boon_PLA_2010.pdf	A recurring question in nonequilibrium statistical mechanics is what deviation from standard statistical mechanics gives rise to non-Boltzmann behavior and to nonlinear response, which amounts to identifying the emergence of “statistics from dynamics” in systems out of equilibrium. Among several possible analytical developments which have been proposed, the idea of nonextensive statistics introduced by Tsallis about 20 years ago was to develop a statistical mechanical theory for systems out of equilibrium where the Boltzmann distribution no longer holds, and to generalize the Boltzmann entropy by a more general function Sq while maintaining the formalism of thermodynamics. From a phenomenological viewpoint, nonextensive statistics appeared to be of interest because maximization of the generalized entropy Sq yields the q-exponential distribution which has been successfully used to describe distributions observed in a large class of phenomena, in particular power law distributions for q > 1. Here we re-examine the validity of the nonextensive formalism for continuous Hamiltonian systems. In particular we consider the q-ideal gas, a model system of quasi-particles where the effect of the interactions are included in the particle properties. On the basis of exact results for the q-ideal gas, we find that the theory is restricted to the range q < 1, which raises the question
79	James F Lutsko, Julien Laidet, and Patrick Grosfils	Phase behavior of a confined nanodroplet in the grand-canonical ensemble: the reverse liquid–vapor transition	J. Phys.: Cond. Matt.	22	65101	2010	Lutsko_Laidet_Grosfils_JCondMatt_2009.pdf	The equilibrium density distribution and thermodynamic properties of a Lennard-Jones fluid confined to nanosized spherical cavities at a constant chemical potential was determined using Monte Carlo simulations. The results describe both a single cavity with semi-permeable walls as well as a collection of closed cavities formed at the constant chemical potential. The results are compared to calculations using classical density functional theory (DFT). It is found that the DFT calculations give a quantitatively accurate description of the pressure and structure of the fluid. Both theory and simulation show the presence of a 'reverse' liquid–vapor transition whereby the equilibrium state is a liquid at large volumes but becomes a vapor at small volumes.
78	Patrick Grosfils and James F. Lutsko	Low-Density/High-Density Liquid Phase Transition for Model Globular Proteins	Langmuir	26	8510	2010	Lutsko_2010_Langmuir.pdf	The effect of molecule size (excluded volume) and the range of interaction on the surface tension, phase diagram, and nucleation properties of a model globular protein is investigated using a combination of Monte Carlo simulations and finite temperature classical density functional theory calculations. We use a parametrized potential that can vary smoothly from the standard Lennard-Jones interaction characteristic of simple fluids to the ten Wolde-Frenkel model for the effective interaction of globular proteins in solution. We find that the large excluded volume characteristic of large macromolecules such as proteins is the dominant effect in determining the liquid-vapor surface tension and nucleation properties. The variation of the range of the potential is important only in the case of small excluded volumes such as for simple fluids. The DFT calculations are then used to study the homogeneous nucleation of the high-density phase from the low-density phase including the nucleation barriers, nucleation pathways, and rate. It is found that the nucleation barriers are typically only a few kBT and that the nucleation rates are substantially higher than would be predicted by classical nucleation theory.
77	James F. Lutsko, Vasileios Basios, Gregoire Nicolis, John J. Kozak, Mike Sleutel, and Dominique Maes	Kinetic rougheninglike transition with finite nucleation barrier	J. of Chemical Physics	132	35102	2010	Lutsko_2010_JCP_1.pdf	Recent observations of the growth of protein crystals have identified two different growth regimes. At low supersaturation, the surface of the crystal is smooth and increasing in size due to the nucleation of steps at defects and the subsequent growth of the steps. At high supersaturation, nucleation occurs at many places simultaneously, the crystal surface becomes rough, and the growth velocity increases more rapidly with increasing supersaturation than in the smooth regime. Kinetic roughening transitions are typically assumed to be due to the vanishing of the barrier for two-dimension nucleation on the surface of the crystal. We show here, by means of both analytic mean-field models and kinetic Monte Carlo simulations, that a transition between different growth modes reminiscent of kinetic roughening can also arise as a kinetic effect occurring at finite nucleation barriers.
76	James F. Lutsko	Recent Developments in Classical Density Functional Theory	Adv. Chem. Phys.	144	1	2010	Lutsko_DFT_Review.pdf	The Density Functional approach to equilibrium statistical mechanics is reviewed. Topics covered include the basic theory behind Density Functional Theory, exact density functionals in low dimension, and theories based on effective liquid approximations. Particular attention is given to more recent developments such as Fundamental Measure Theory for hard-spheres, Dynamical Density Functional Theory and the determination of state transition pathways.
75	James F. Lutsko, Vasileios Basios, Grégoire Nicolis, Tom P. Caremans, Alexander Aerts, Johan A. Martens, Christine E. A. Kirschhock, and Titus S. van Erp	Kinetics of intermediate-mediated self-assembly in nanosized materials: A generic model	J. of Chemical Physics	132	164701	2010	Lutsko_2010_JCP_2.pdf	We propose in this paper a generic model of a nonstandard aggregation mechanism for self-assembly processes of a class of materials involving the mediation of intermediates consisting of a polydisperse population of nanosized particles. The model accounts for a long induction period in the process. The proposed mechanism also gives insight on future experiments aiming at a more comprehensive picture of the role of self-organization in self-assembly processes.
74	Patrick Grosfils and James F. Lutsko	Dependence of the liquid-vapor surface tension on the range of interaction: A test of the law of corresponding states	J. of Chemical Physics	130	54703	2009	Lutsko_JCP_2009_1.pdf	The planar surface tension of coexisting liquid and vapor phases of a fluid of Lennard-Jones atoms is studied as a function of the range of the potential using both Monte Carlo simulations and Density Functional Theory. The interaction range is varied from rc* = 2.5 to rc* = 6 and the surface tension is determined for temperatures ranging from T* = 0.7 up to the critical temperature in each case. The results are shown to be consistent with previous studies. The simulation data are well-described by Guggenheim's law of corresponding states but the agreement of the theoretical results depends on the quality of the bulk equation of state.
73	J. F. Lutsko, J. P. Boon, and P. Grosfils	 Is the Tsallis entropy stable?	EuroPhys. Lett.	86	40005	2009	Lutsko_EPL_2009_1.pdf	The question of whether the Tsallis entropy is Lesche-stable is revisited. It is argued that when physical averages are computed with the escort probabilities, the correct application of the concept of Lesche-stability requires use of the escort probabilities. As a consequence, as shown here, the Tsallis entropy is unstable but the thermodynamic averages are stable. We further show that Lesche stability as well as thermodynamic stability can be obtained if the homogeneous entropy is used as the basis of the formulation of non-extensive thermodynamics. In this approach, the escort distribution arises naturally as a secondary structure.
72	James F. Lutsko	Reply to the Comment by M. Iwamatsu	EuroPhys. Lett.	86	26002	2009	Lutsko_EPL_2009_2.pdf	
71	Wm. G. Hoover, Carol G. Hoover, and James F. Lutsko	Microscopic and macroscopic stress with gravitational and rotational forces	Phys. Rev. E	79	36709	2009	PhysRevE.79.036709.pdf	Many recent papers have questioned Irving and Kirkwood’s atomistic expression for stress. In Irving and Kirkwood’s approach both interatomic forces and atomic velocities contribute to stress. It is the velocity-dependent part that has been disputed. To help clarify this situation we investigate (i) a fluid in a gravitational field and (ii) a steadily rotating solid. For both problems we choose conditions where the two stress contributions, potential and kinetic, are significant. The analytic force-balance solutions of both these problems agree very well with a smooth-particle interpretation of the atomistic Irving-Kirkwood stress tensor.
70	James F. Lutsko and Jean P. Boon	Generalized diffusion: A microscopic approach.	Phys. Rev. E	77	51103	2008	Lutsko_PRE_2008_1.pdf	The Fokker-Planck equation for the probability f(r,t) to find a random walker at position r at time t is derived for the case that the probability to make jumps depends nonlinearly on f(r,t). The result is a generalized form of the classical Fokker-Planck equation where the effects of drift, due to a violation of detailed balance, and of external fields are also considered. It is shown that in the absence of drift and external fields a scaling solution, describing anomalous diffusion, is possible only if the nonlinearity in the jump probability is of the power law type [ f(r,t)], in which case the generalized Fokker-Planck equation reduces to the porous media equation. Monte Carlo simulations are shown to confirm the theoretical results.
69	James F. Lutsko	Density functional theory of inhomogeneous liquids. III. Liquid-vapor nucleation	J. of Chemical Physics	129	244501	2008	Lutsko_JCP_2008_3.pdf	The process of nucleation of vapor bubbles from a superheated liquid and of liquid droplets from a supersaturated vapor is investigated using the Modified-Core van der Waals model Density Functional Theory (Lutsko, JCP 128, 184711 (2008)). A novel approach is developed whereby nucleation is viewed as a transition from a metastable state to a stable state via the minimum free energy path which is identified using the nudged elastic-band method for exploring free energy surfaces. This allows for the unbiased calculation of the properties of sub- and super-critical clusters, as well as of the critical cluster. For Lennard-Jones fluids, the results compare well to simulation and support the view that even at high supersaturation nucleation proceeds smoothly rather than via spinodal-like instabilities as has been suggested recently.
68	James F. Lutsko	 Density functional theory of inhomogeneous liquids. II. A fundamental measure approach	J. of Chemical Physics	128	184711	2008	Lutsko_JCP_2008_1.pdf	Previously, it has been shown that the direct correlation function for a Lennard–Jones fluid could be modeled by a sum of that for hard-spheres, a mean-field tail, and a simple linear correction in the core region constructed so as to reproduce the (known) bulk equation of state of the fluid [Lutsko, J. Chem. Phys. 127, 054701 (2007)]. Here, this model is combined with ideas from the fundamental measure theory to construct a density functional theory for the free energy. The theory is shown to accurately describe a range of inhomogeneous conditions including the liquid vapor interface, the fluid in contact with a hard wall, and a fluid confined in a slit pore. The theory gives quantitatively accurate predictions for the surface tension, including its dependence on the potential cutoff. It also obeys two important exact conditions: That relating the direct correlation function to the functional derivative of the free energy with respect to density and the wall theorem.
67	James F. Lutsko	Theoretical description of the nucleation of vapor bubbles in a superheated fluid	EuroPhys. Lett.	83	46007	2008	Lutsko_EPL_2008_1.pdf	The nucleation of vapor bubbles within a superheated fluid is studied using density functional theory. The nudged elastic band technique is used to find the minimum energy pathway from the metastable uniform liquid to the stable uniform gas thus emphasizing the analogy between the the nucleation problem and that of chemical reactions. The result is both an accurate determination of the critical nucleus and an unbiased description of the density profile at various points along the path between the free energy extrema. This calculation is compared to two other methods: the use of parametrized profiles and constrained minimization of the free energy. The results indicate that the recent claim, based on the constraint method, that bubble nucleation and growth involves an activated instability is incorrect.
66	James F. Lutsko	Density functional theory of inhomogeneous liquids. I. The liquid-vapor interface in Lennard-Jones fluids	J. of Chemical Physics	127	54701	2007	Lutsko_JCP_2007.pdf	A simple model is proposed for the direct correlation function (DCF) for simple fluids consisting of a hard-core contribution, a simple parametrized core correction, and a mean-field tail. The model requires as input only the free energy of the homogeneous fluid, obtained, e.g., from thermodynamic perturbation theory. Comparison to the DCF obtained from simulation of a Lennard-Jones fluid shows this to be a surprisingly good approximation for a wide range of densities. The model is used to construct a density functional theory for inhomogeneous fluids which is applied to the problem of calculating the surface tension of the liquid-vapor interface. The numerical values found are in good agreement with simulation.
65	Jean Pierre Boon and James F. Lutsko	From Einstein to generalized diffusion	AIP Conference Proceedings	965	157	2007	Boon_Lutsko_AIP_2007.pdf	We show that from a generalization of Einstein's master equation for the random walk one obtains a generalized equation for diffusion processes. The master equation is generalized by making the particle jump probability Pj(r) a functional of the particle distribution function f(r,t). If one demands that the resulting generalized diffusion equation admits of scaling solutions: f(r;t) = t−gamma/2phi(r/tgamma/2), a power law Pj(r)[proportional]f(r)alpha−1 (with alpha>1) follows, and the solutions exhibit q-exponential forms which are found to be in agreement with the results of Monte-Carlo simulations, providing a microscopic basis validating the nonlinear diffusion equation. We also show that the phenomenological porous media equation is an approximation to the generalized advection-diffusion equation.
