url_slug	authors	title	Journal	Volume	Pages	Year	paper_url	excerpt
64	J. P. Boon and J. F. Lutsko	Nonlinear diffusion from Einstein's master equation	EuroPhys. Lett.	80	60006	2007	Boon_Lutsko_EPL_2007.pdf	We generalize Einstein's master equation for random-walk processes by considering that the probability for a particle at position r to make a jump of length j lattice sites, Pj(r), is a functional of the particle distribution function f(r, t). By multiscale expansion, we obtain a generalized advection-diffusion equation. We show that the power law Pj(r)[?]f(r)a-1 (with a>1) follows from the requirement that the generalized equation admits scaling solutions (f(r;t)=t[?]gph(r/tg)). The solutions have a q-exponential form and are found to be in agreement with the results of Monte Carlo simulations, so providing a microscopic basis validating the nonlinear diffusion equation. Although its hydrodynamic limit is equivalent to the phenomenological porous media equation, there are extra terms which, in general, cannot be neglected as evidenced by the Monte Carlo computations.
63	James F. Lutsko	Chapman-Enskog expansion about nonequilibrium states with application to the sheared granular fluid	Phys. Rev. E	73	21302	2006	Lutsko_PRE_2006_1.pdf	The Chapman-Enskog method of solution of kinetic equations, such as the Boltzmann equation, is based on an expansion in gradients of the deviations of the hydrodynamic fields from a uniform reference state (e.g., local equilibrium). This paper presents an extension of the method so as to allow for expansions about arbitrary, far-from-equilibrium reference states. The primary result is a set of hydrodynamic equations for studying variations from the arbitrary reference state which, unlike the usual Navier-Stokes hydrodynamics, does not restrict the reference state in any way. The method is illustrated by application to a sheared granular gas which cannot be studied using the usual Navier-Stokes hydrodynamics.
62	James F. Lutsko and Grégoire Nicolis	Theoretical Evidence for a Dense Fluid Precursor to Crystallization	Phys. Rev. Lett.	96	46102	2006	Lutsko_PRL_2006_1.pdf	We present classical density functional theory calculations of the free-energy landscape for fluids below their triple point as a function of density and crystallinity. We find that, both for a model globular protein and for a simple atomic fluid modeled with a Lennard-Jones interaction, it is free-energetically easier to crystallize by passing through a metastable dense fluid in accord with the Ostwald rule of stages but in contrast to the alternative of ordering and densifying at once as assumed in the classical picture of crystallization.
61	Jean Pierre Boon and James F. Lutsko	Generalized diffusion equation	Physica A	368	55	2006	Lutsko_Physica_2006_2.pdf	Modern analyses of diffusion processes have proposed nonlinear versions of the Fokker–Planck equation to account for nonclassical diffusion. These nonlinear equations are usually constructed on a phenomenological basis. Here, we introduce a nonlinear transformation by defining the q-generating function which, when applied to the intermediate scattering function of classical statistical mechanics, yields, in a mathematically systematic derivation, a generalized form of the advection–diffusion equation in Fourier space. Its solutions are discussed and suggest that the q-generating function approach should be a useful method to generalize classical diffusive transport formulations.
60	James F. Lutsko	 First principles derivation of Ginzburg–Landau free energy models for crystalline systems	Physica A	366	229	2006	Lutsko_Physica_2006_1.pdf	The expression of the free energy density of a classical crystalline system as a gradient expansion in terms of a set of order parameters is developed using classical density functional theory. The goal here is to extend and complete an earlier derivation by Löwen et al. [Europhys. Lett. 9 (1989) 791]. The limitations of the resulting expressions are also discussed including the boundary conditions needed for finite systems and the fact that the results cannot, at present, be used to take into account elastic relaxation.
